{
  "$schema": "http://json-schema.org/draft-07/schema#",
  "type": "object",
  "properties": {
    "candidate_id": { "type": "string" },
    "full_name": { "type": "string" },
    "emails": {
      "type": "array",
      "items": { "type": "string", "format": "email" }
    },
    "phones": {
      "type": "array",
      "items": { "type": "string" }
    },
    "location": {
      "type": "object",
      "properties": {
        "city": { "type": ["string", "null"] },
        "region": { "type": ["string", "null"] },
        "country": { "type": ["string", "null"], "minLength": 2, "maxLength": 2 }
      },
      "required": ["city", "region", "country"]
    },
    "links": {
      "type": "object",
      "properties": {
        "linkedin": { "type": ["string", "null"] },
        "github": { "type": ["string", "null"] },
        "portfolio": { "type": ["string", "null"] },
        "other": { "type": "array", "items": { "type": "string" } }
      }
    },
    "headline": { "type": ["string", "null"] },
    "years_experience": { "type": ["number", "null"] },
    "skills": {
      "type": "array",
      "items": {
        "type": "object",
        "properties": {
          "name": { "type": "string" },
          "confidence": { "type": "number", "minimum": 0.0, "maximum": 1.0 },
          "sources": { "type": "array", "items": { "type": "string" } }
        },
        "required": ["name", "confidence", "sources"]
      }
    },
    "experience": {
      "type": "array",
      "items": {
        "type": "object",
        "properties": {
          "company": { "type": "string" },
          "title": { "type": "string" },
          "start": { "type": "string" },
          "end": { "type": ["string", "null"] },
          "summary": { "type": ["string", "null"] }
        },
        "required": ["company", "title", "start", "end"]
      }
    },
    "education": {
      "type": "array",
      "items": {
        "type": "object",
        "properties": {
          "institution": { "type": "string" },
          "degree": { "type": ["string", "null"] },
          "field": { "type": ["string", "null"] },
          "end_year": { "type": ["integer", "null"] }
        },
        "required": ["institution"]
      }
    },
    "provenance": {
      "type": "array",
      "items": {
        "type": "object",
        "properties": {
          "field": { "type": "string" },
          "source": { "type": "string" },
          "method": { "type": "string" }
        },
        "required": ["field", "source", "method"]
      }
    },
    "overall_confidence": { "type": "number", "minimum": 0.0, "maximum": 1.0 }
  },
  "required": ["candidate_id", "full_name", "emails"]
}
